[
  {
    "rank": 1,
    "name": "PSA OpenSTAT PXWeb API",
    "owner": "Philippine Statistics Authority",
    "coverage": "Philippines with national, regional, and selected city/HUC breakdowns including NCR",
    "data_type": "official statistics API",
    "access_method": "PXWeb REST API with table metadata and POST queries",
    "endpoint_or_download_url": "https://openstat.psa.gov.ph/PXWeb/api/v1/en/DB",
    "formats": ["JSON metadata", "JSON-stat", "CSV", "PX"],
    "auth_required": "No",
    "rate_limits": "OpenSTAT docs state 10 requests per 10 seconds; direct API should be throttled",
    "last_updated_signal": "API live on 2026-07-03; table-level freshness varies by domain",
    "freshness_grade": "A",
    "metro_manila_filter_method": "Use table-specific geolocation dimensions for National Capital Region, NCR PSGC, or city/HUC rows",
    "sample_query": "curl -sS https://openstat.psa.gov.ph/PXWeb/api/v1/en/DB/1A/PO/0011A6DPHH0.px",
    "market_research_use_cases": ["population denominators", "income and spending proxies", "prices", "sector sizing", "economic benchmarking"],
    "license_or_terms": "OpenSTAT states open reuse with source attribution; PSA pages say content is public domain unless otherwise stated",
    "risks": "Table IDs and value codes must be discovered from metadata; documentation pages may block plain curl even when API endpoints work",
    "source_url": "https://openstat.psa.gov.ph/API-Documentation",
    "status": "active",
    "scores": {
      "accessibility": 5,
      "freshness": 5,
      "metro_manila_specificity": 4,
      "automation_value": 5,
      "license_clarity": 4,
      "market_signal_quality": 5,
      "total": 28
    },
    "notes": "Local live checks returned HTTP 200 for the PXWeb DB index and population table metadata."
  },
  {
    "rank": 2,
    "name": "PSGC GitLab API mirror",
    "owner": "Community mirror based on PSA PSGC data",
    "coverage": "Philippine regions, provinces, cities, municipalities, sub-municipalities, and barangays",
    "data_type": "geographic code hierarchy API",
    "access_method": "static JSON REST endpoints",
    "endpoint_or_download_url": "https://psgc.gitlab.io/api/",
    "formats": ["JSON"],
    "auth_required": "No",
    "rate_limits": "Static hosting limits only; no published API quota",
    "last_updated_signal": "API docs show current data as of June 30, 2022; NCR endpoint live on 2026-07-03",
    "freshness_grade": "C",
    "metro_manila_filter_method": "Use NCR region code 130000000; example endpoint /regions/130000000/barangays.json",
    "sample_query": "curl -sS https://psgc.gitlab.io/api/regions/130000000/barangays.json",
    "market_research_use_cases": ["location normalization", "barangay/city joins", "address forms", "PSA table joins"],
    "license_or_terms": "Mirror project terms; source data from PSA PSGC",
    "risks": "Mirror may lag official PSGC; use official PSA publication/API for formal reporting",
    "source_url": "https://psgc.gitlab.io/api/",
    "status": "active",
    "scores": {
      "accessibility": 5,
      "freshness": 3,
      "metro_manila_specificity": 5,
      "automation_value": 5,
      "license_clarity": 3,
      "market_signal_quality": 4,
      "total": 25
    },
    "notes": "Local live check returned HTTP 200 and a 452 KB NCR barangay JSON payload."
  },
  {
    "rank": 3,
    "name": "HDX Philippines COD-AB",
    "owner": "OCHA / Humanitarian Data Exchange, with PSA/NAMRIA-derived boundary sources",
    "coverage": "Philippines administrative boundaries admin 0-4",
    "data_type": "boundary downloads and CKAN package metadata",
    "access_method": "HDX CKAN Action API plus resource downloads",
    "endpoint_or_download_url": "https://data.humdata.org/api/3/action/package_show?id=cod-ab-phl",
    "formats": ["GeoJSON ZIP", "SHP ZIP", "GDB ZIP", "XLSX"],
    "auth_required": "No for public downloads",
    "rate_limits": "Not published; use CKAN pagination and polite download behavior",
    "last_updated_signal": "Package API returned resources and current metadata on 2026-07-03",
    "freshness_grade": "A",
    "metro_manila_filter_method": "Filter admin records by NCR name or P-code such as PH13",
    "sample_query": "curl -sS 'https://data.humdata.org/api/3/action/package_show?id=cod-ab-phl'",
    "market_research_use_cases": ["spatial joins", "barangay/city catchments", "admin boundary overlays", "offline GIS"],
    "license_or_terms": "Dataset-specific HDX license; verify resource metadata before redistribution",
    "risks": "Countrywide files can be large; boundary vintages and source lineage should be noted in analysis",
    "source_url": "https://data.humdata.org/dataset/cod-ab-phl",
    "status": "active",
    "scores": {
      "accessibility": 5,
      "freshness": 5,
      "metro_manila_specificity": 4,
      "automation_value": 5,
      "license_clarity": 4,
      "market_signal_quality": 4,
      "total": 27
    },
    "notes": "Local live check returned HTTP 200 and resource URLs for GeoJSON, SHP, GDB, and XLSX."
  },
  {
    "rank": 4,
    "name": "MMDA Metro Manila City/Municipality Boundary FeatureServer",
    "owner": "Metro Manila GIS Database Project / MMDA ArcGIS organization",
    "coverage": "17 Metro Manila cities/municipality",
    "data_type": "ArcGIS FeatureServer polygon layer",
    "access_method": "ArcGIS REST layer metadata and query endpoints",
    "endpoint_or_download_url": "https://services1.arcgis.com/Jlef2HFcOgOf9c7u/arcgis/rest/services/MMDAOAGMP_MetroManilaCityMunicipalityBoundary/FeatureServer/0",
    "formats": ["ArcGIS JSON", "GeoJSON via query", "CSV/ZIP through Hub where enabled"],
    "auth_required": "No",
    "rate_limits": "maxRecordCount=2000",
    "last_updated_signal": "Layer metadata and count endpoint live on 2026-07-03",
    "freshness_grade": "B",
    "metro_manila_filter_method": "Already NCR-scoped; use CityMunicipality and CityMunicipalityPSGC fields",
    "sample_query": "curl -s 'https://services1.arcgis.com/Jlef2HFcOgOf9c7u/arcgis/rest/services/MMDAOAGMP_MetroManilaCityMunicipalityBoundary/FeatureServer/0/query?where=1%3D1&returnCountOnly=true&f=json'",
    "market_research_use_cases": ["territory boundaries", "city-level joins", "site-selection clipping", "LGU normalization"],
    "license_or_terms": "Layer-level license not clearly stated; check ArcGIS item metadata before redistribution",
    "risks": "ArcGIS item permissions can change; license fields may be blank",
    "source_url": "https://metro-manila-geographic-information-system-hub-mmda.hub.arcgis.com/",
    "status": "active",
    "scores": {
      "accessibility": 5,
      "freshness": 4,
      "metro_manila_specificity": 5,
      "automation_value": 5,
      "license_clarity": 2,
      "market_signal_quality": 4,
      "total": 25
    },
    "notes": "Local live check returned count 17 and fields including RegionPSGC and CityMunicipalityPSGC."
  },
  {
    "rank": 5,
    "name": "MMDA ArcGIS FeatureServices",
    "owner": "Metro Manila GIS Database Project / MMDA ArcGIS organization",
    "coverage": "Metro Manila public GIS layers including schools, rivers, flood-prone areas, and establishments",
    "data_type": "ArcGIS FeatureServer layers",
    "access_method": "ArcGIS Online Sharing REST search and item-level query endpoints",
    "endpoint_or_download_url": "https://www.arcgis.com/sharing/rest/search?f=json&q=orgid:Jlef2HFcOgOf9c7u%20AND%20type:%22Feature%20Service%22&num=10",
    "formats": ["ArcGIS JSON", "GeoJSON", "CSV/ZIP where enabled"],
    "auth_required": "No for public layers tested",
    "rate_limits": "Feature service maxRecordCount applies per layer",
    "last_updated_signal": "ArcGIS org search returned 27 public Feature/Map services on 2026-07-03",
    "freshness_grade": "B",
    "metro_manila_filter_method": "Many layers are NCR-scoped; otherwise query city fields such as CityMunic, CITY_MUNIC, or LGU",
    "sample_query": "curl -s 'https://services1.arcgis.com/Jlef2HFcOgOf9c7u/arcgis/rest/services/MM_Schools/FeatureServer/0/query?where=1%3D1&returnCountOnly=true&f=json'",
    "market_research_use_cases": ["education demand anchors", "flood/site risk", "local POI enrichment", "urban infrastructure overlays"],
    "license_or_terms": "Layer-specific; not consistently stated",
    "risks": "Some layers may be test/noisy or underdocumented; validate feature quality before using in production",
    "source_url": "https://metro-manila-geographic-information-system-hub-mmda.hub.arcgis.com/",
    "status": "active",
    "scores": {
      "accessibility": 5,
      "freshness": 4,
      "metro_manila_specificity": 5,
      "automation_value": 5,
      "license_clarity": 2,
      "market_signal_quality": 4,
      "total": 25
    },
    "notes": "Local live check returned 2,747 features for MM_Schools."
  },
  {
    "rank": 6,
    "name": "BetterGov Open Data Portal API",
    "owner": "BetterGov.ph community",
    "coverage": "Philippines with some NCR-relevant datasets",
    "data_type": "open-data catalog API",
    "access_method": "REST API",
    "endpoint_or_download_url": "https://data.bettergov.ph/api/v1/datasets",
    "formats": ["JSON", "resource-specific CSV", "GeoJSON", "Parquet"],
    "auth_required": "No",
    "rate_limits": "Not published",
    "last_updated_signal": "Subagent live check found /api/v1/stats returning 23 datasets and 432 resources",
    "freshness_grade": "A",
    "metro_manila_filter_method": "Search tags/descriptions for NCR, Metro Manila, barangay, city names, and PSGC codes",
    "sample_query": "curl -s 'https://data.bettergov.ph/api/v1/datasets?limit=10&search=barangay'",
    "market_research_use_cases": ["dataset discovery", "boundary joins", "fiscal/procurement leads", "source triangulation"],
    "license_or_terms": "Project README states CC0; verify primary source attribution per dataset",
    "risks": "Community-run; `/api/3/action` CKAN path returned 404 locally, so use documented v1 endpoints",